stop,name_en,name_tc,name_sc,lat,long,data_timestamp
EEFA4F8B18DBF2A6,WO HING TSUEN (ND370),和興村 (ND370),和兴村 (ND370),22.484716,114.146218,
3325529D981E23A1,YAN FAI HOUSE YAN SHING COURT (ND375),欣盛苑欣暉閣 (ND375),欣盛苑欣晖阁 (ND375),22.486277,114.138985,
A4455CCA999A234C,HONG MING HOUSE WAH MING ESTATE (ND376),華明邨康明樓 (ND376),华明邨康明楼 (ND376),22.483854,114.139461,
3C821C86ADED2B9D,YIU MING HOUSE WAH MING ESTATE (ND378),華明邨耀明樓 (ND378),华明邨耀明楼 (ND378),22.482476,114.141439,
7234BEA4242461F7,FO TAN (SHAN MEI STREET) BUS TERMINUS (FT957),火炭(山尾街)總站 (FT957),火炭(山尾街)总站 (FT957),22.396452,114.194295,
3C624F6CB2D5BBEA,FORTUNE CITY ONE (ST302),置富第一城 (ST302),置富第一城 (ST302),22.386783,114.203571,
24E16716BBB7F2D0,PRINCE OF WALES HOSPITAL (ST860),威爾斯親王醫院 (ST860),威尔斯亲王医院 (ST860),22.381229,114.201162,
62E1009AA8AED0B8,YU CHUI COURT BUS TERMINUS (ST873),愉翠苑巴士總站 (ST873),愉翠苑巴士总站 (ST873),22.381882,114.205456,
4D99E0E24AF289E9,PRINCE OF WALES HOSPITAL (ST861),威爾斯親王醫院 (ST861),威尔斯亲王医院 (ST861),22.381334,114.201583,
3AFDEDDED05FAEB3,FO TAN (SHAN MEI STREET) BUS TERMINUS (FT956),火炭(山尾街)總站 (FT956),火炭(山尾街)总站 (FT956),22.396383,114.194294,
11B658F68A9F577C,KWONG FUK ESTATE (TP265),廣福邨　 (TP265),广福邨　 (TP265),22.446299,114.173076,
43531EDD45A4B0C1,TAI PO CENTRAL BUS TERMINUS (TP913),大埔中心總站 (TP913),大埔中心总站 (TP913),22.453289,114.169337,
EDFAC4F35C0E51C7,RHENISH CHURCH SECONDARY SCHOOL (ND567),禮賢會中學 (ND567),礼贤会中学 (ND567),22.497188,114.141291,
FEC59562CBC99F5E,FANLING LAW COURTS BUILDING (ND452),粉嶺法院大樓 (ND452),粉岭法院大楼 (ND452),22.495489,114.139870,
650809D260BC7C6E,NORTH DISTRICT PARK NORTH GATE (ND453),北區公園北門 (ND453),北区公园北门 (ND453),22.499589,114.135119,
F81DACC5F39E6D53,SUNNINGDALE GARDEN (ND454),順欣花園 (ND454),顺欣花园 (ND454),22.501738,114.133073,
D876A83244ECB838,SHEUNG SHUI BBI - SHEUNG SHUI STATION(B5) (ND479),上水轉車站 - 上水站(B5),上水转车站 - 上水站(B5),22.501988,114.127349,
CACE8456C1A48D50,FANLING HIGHWAY BBI (A4) (TP100),粉嶺公路轉車站(A4) (TP100),粉岭公路转车站(A4) (TP100),22.484781,114.152709,
E0908A8C2459FA0F,NINA TOWER BUS TERMINUS (TW957),如心廣場巴士總站 (TW957),如心广场巴士总站 (TW957),22.368322,114.112290,
2D1A8946EF054FC9,HONG KONG INSTITUTE OF BIOTECHNOLOGY (PA107),香港生物科技研究院 (PA107),香港生物科技研究院 (PA107),22.423223,114.213922,
DADEC4FDAD7C58B3,SCIENCE PARK (PHASE 1) (PA122),科學園(第一期) (PA122),科学园(第一期) (PA122),22.424247,114.211432,
E8F5E085BAEFE100,FO YIN ROAD (PA124),科研路 (PA124),科研路 (PA124),22.426628,114.208027,
79FD1B44D37205B8,St MARTIN (PA127),雲滙 (PA127),云滙 (PA127),22.429561,114.203338,
369A5601F8A63B5E,PAK SHEK KOK (PA129),白石角 (PA129),白石角 (PA129),22.431492,114.201512,
A339426A8F633D63,PAK SHEK KOK SUBSTATION (PA130),白石角變電站 (PA130),白石角变电站 (PA130),22.433895,114.200812,
530F970BB56D778D,KWONG FUK ROAD BBI - PO HEUNG BRIDGE (B1) (TP302),廣福道轉車站 - 寶鄉橋 (B1),广福道转车站 - 宝乡桥 (B1),22.449775,114.166962,
1DB270D8A2092753,FU SHIN BUS TERMINUS (TP965),富善總站 (TP965),富善总站 (TP965),22.453900,114.174845,
5FA8B50329B85F1A,KWONG FUK MARKET (TP553),廣福街市 (TP553),广福街市 (TP553),22.448725,114.174689,
4DD5EC5516B360D7,PROVIDENCE BAY (PA204),天賦海灣 (PA204),天赋海湾 (PA204),22.431492,114.201558,
33ABA49F0E91A247,St MARTIN (PA209),雲滙 (PA209),云滙 (PA209),22.429805,114.203323,
023E9E5A9E073E1A,CHONG SAN ROAD (PA211),創新路 (PA211),创新路 (PA211),22.428649,114.204981,
B464BD6334A93FA1,FO YIN ROAD (PA216),科研路 (PA216),科研路 (PA216),22.426442,114.208450,
5C2A974134634635,SCIENCE PARK (PHASE 1) (PA220),科學園(第一期) (PA220),科学园(第一期) (PA220),22.424272,114.211589,
75BC2D1936D0EACD,TAI PO WATERFRONT PARK (TP600),大埔海濱公園 (TP600),大埔海滨公园 (TP600),22.451677,114.177012,
ADF5445FF5059D45,TAI PO INDUSTRIAL ESTATE (TP872),大埔工業邨 (TP872),大埔工业邨 (TP872),22.457664,114.187690,
5998A11C63EAB82E,TAI PO EAST FIRE STATION (TP623),大埔東消防局 (TP623),大埔东消防局 (TP623),22.462336,114.190670,
A1A1CE1BACE1973D,THE EDUCATION UNIVERSITY OF HK (TP891),香港教育大學 (TP891),香港教育大学 (TP891),22.466682,114.193577,
790B8E94D15A0888,TAI PO WATERFRONT PARK (TP780),大埔海濱公園 (TP780),大埔海滨公园 (TP780),22.452289,114.177642,
C799751FDFCE292E,SHEUNG SHUI BBI - SHEUNG SHUI TERMINUS (A1),上水轉車站 - 上水總站(A1),上水转车站 - 上水总站(A1),22.502744,114.127704,
FC6CB9607D36FBD7,SHEK WU HUI POST OFFICE (ND490),石湖墟郵政局 (ND490),石湖墟邮政局 (ND490),22.503864,114.126644,
A67D189D438E1534,SHEUNG SHUI WAI (ND102),上水圍 (ND102),上水围 (ND102),22.506883,114.126144,
100141C63A642F1A,FUNG KAI NO.1 SECONDARY SCHOOL (ND456),鳳溪第一中學 (ND456),凤溪第一中学 (ND456),22.511240,114.126255,
5407432C01D5436D,FU TEI AU (ND460),虎地坳 (ND460),虎地坳 (ND460),22.518893,114.124746,
D1CF96D7F9E6E0D3,CHEUNG PO TAU (ND461),長甫頭 (ND461),长甫头 (ND461),22.520844,114.123417,
03C2FCE0BF616CB6,LO WU STATION ROAD (ND462),羅湖道 (ND462),罗湖道 (ND462),22.524216,114.121942,
F772B9044DD2F773,SHA LING TSUEN (ND463),沙嶺村 (ND463),沙岭村 (ND463),22.526359,114.123797,
012BE724358D1EE1,SANDY RIDGE (ND464),沙嶺 (ND464),沙岭 (ND464),22.527708,114.125149,
66011988F615D538,SAN UK LING FIRING GROUND (ND465),新屋嶺練靶場 (ND465),新屋岭练靶场 (ND465),22.531278,114.128919,
155F1F0445747AE7,MAN KAM TO LORRY WAITING AREA (ND466),文錦渡貨車輪候區 (ND466),文锦渡货车轮候区 (ND466),22.534541,114.131667,
E97F002DCFA395B1,MAN KAM TO (SAN UK LING VILLAGE) (ND220),文錦渡(新屋嶺村) (ND220),文锦渡(新屋岭村) (ND220),22.534639,114.131749,
3E361632FD814F53,SAN UK LING FIRING GROUND (ND221),新屋嶺練靶場 (ND221),新屋岭练靶场 (ND221),22.530704,114.128579,
2327BAC99994C941,SANDY RIDGE (ND222),沙嶺 (ND222),沙岭 (ND222),22.528071,114.125639,
B70A225FA9659A22,LO WU STATION ROAD (ND223),羅湖道 (ND223),罗湖道 (ND223),22.525839,114.123426,
24E3010DECCD1055,CHEUNG PO TAU (ND224),長甫頭 (ND224),长甫头 (ND224),22.521019,114.123373,
3381D9676D0B29C8,FU TEI AU (ND225),虎地坳 (ND225),虎地坳 (ND225),22.518904,114.124861,
95DEB5378CCEB9D2,FUNG KAI NO.1 SECONDARY SCHOOL (ND240),鳳溪第一中學 (ND240),凤溪第一中学 (ND240),22.510260,114.126625,
45924F2D86BEC3B4,"PO SHEK WU ROAD SHEUNG SHUI, SHEUNG SHUI WAI",上水寶石湖路-上水圍 (ND435),上水宝石湖路-上水围 (ND435),22.506436,114.126044,
89D8AA4F45165FB6,SHEK WU HUI POST OFFICE (ND170),石湖墟郵政局 (ND170),石湖墟邮政局 (ND170),22.503795,114.126836,
05391B53044E30A8,YEUNG UK ROAD MARKET (TW581),楊屋道街市 (TW581),杨屋道街市 (TW581),22.368510,114.114978,
30220834842952E1,WING KEI ROAD (KW180),永基路 (KW180),永基路 (KW180),22.361225,114.120238,
FFE2A036843CD6A3,SHING FUK STREET (KW181),盛福街 (KW181),盛福街 (KW181),22.359107,114.121163,
C044260C4C65B4F9,LO FAI ROAD TAI PO (TP624),大埔露輝路 (TP624),大埔露辉路 (TP624),22.461422,114.193105,
F71DE7248DAAFAF7,FORTUNE GARDEN (TP625),雅景花園 (TP625),雅景花园 (TP625),22.459667,114.197487,
1A5B7BF397988C96,SAM MUN TSAI ROAD TAI PO (TP626),大埔三門仔路 (TP626),大埔三门仔路 (TP626),22.460590,114.203849,
C1AE59CABFFE3F21,"WONG YUE TAN, LOK SIN VILLAGE (TP627)",黃魚灘 - 樂善村 (TP627),黄鱼滩 - 乐善村 (TP627),22.462247,114.205840,
9076C3C55544591A,SHUEN WAN (TP628),船灣 (TP628),船湾 (TP628),22.464399,114.207692,
EE0564AA4EA08E5D,SAN TAU KOK TUNG TSZ ROAD (TP629),䃟頭角 - 洞梓路 (TP629),䃟头角 - 洞梓路 (TP629),22.468880,114.209219,
FF435BF47EA33D74,PO SUM PAI (TP630),布心排 (TP630),布心排 (TP630),22.470727,114.210855,
EEF2A14EF9A8E0C3,LAI PEK SHAN (TP631),犁壁山 (TP631),犁壁山 (TP631),22.473238,114.213139,
1AEC1D13DFEDEEEE,GREEN COVE (TP632),映月灣 (TP632),映月湾 (TP632),22.472811,114.215793,
C21F7A494FFEAC2C,TING KOK (TP633),汀角 (TP633),汀角 (TP633),22.470448,114.219639,
70B01F3E554003C9,SHAN LIU (TP634),山寮 (TP634),山寮 (TP634),22.471436,114.222850,
45AAE55CB6B5699F,LO TSZ TIN (LUNG MEI BEACH) (TP635),蘆慈田(龍尾泳灘) (TP635),芦慈田(龙尾泳滩) (TP635),22.471803,114.226239,
391FD1F8D3A9167F,LUNG MEI VILLAGE (TP636),龍尾村 (TP636),龙尾村 (TP636),22.472218,114.229580,
5A264033612771AA,LUNG MEI (TP637),龍尾 (TP637),龙尾 (TP637),22.472611,114.231773,
20B7C6B56788E484,TAI MEI TUK BUS TERMINUS (TP886),大美督總站 (TP886),大美督总站 (TP886),22.472380,114.232989,
6EAC23CB146AE03C,LO TSZ TIN (LUNG MEI BEACH) (TP722),蘆慈田(龍尾泳灘) (TP722),芦慈田(龙尾泳滩) (TP722),22.471752,114.226879,
4BF5699F5C8308BC,SHING FUK STREET (KW551),盛福街 (KW551),盛福街 (KW551),22.358690,114.122074,
33F3C429C71DA237,WING KEI ROAD (KW552),永基路 (KW552),永基路 (KW552),22.361314,114.120071,
9F481C8D1469C29C,TAI PO CENTRAL BUS TERMINUS (TP902),大埔中心總站 (TP902),大埔中心总站 (TP902),22.452896,114.168960,
2CBA3E00C7A4477A,TAI PO CENTRAL BUS TERMINUS (TP912),大埔中心總站 (TP912),大埔中心总站 (TP912),22.453287,114.169089,
CB7FA5CF40D4413A,KWONG FUK ROAD BBI (Y3) (TP566),廣福道轉車站 (Y3) (TP566),广福道转车站 (Y3) (TP566),22.448165,114.168091,
9B5260033565575F,FU TIP BUS TERMINUS (TP926),富蝶總站 (TP926),富蝶总站 (TP926),22.462699,114.176025,
261392BB77CC768D,PROVIDENCE BAY (PA203),天賦海灣 (PA203),天赋海湾 (PA203),22.431492,114.201558,
07AB149DAD888683,St MARTIN (PA207),雲滙 (PA207),云滙 (PA207),22.429805,114.203323,
3A7AC3A5F9530786,CHONG SAN ROAD (PA210),創新路 (PA210),创新路 (PA210),22.428649,114.204981,
1D1571E9D1588FBE,HONG KONG INSTITUTE OF BIOTECHNOLOGY (PA231),香港生物科技研究院 (PA231),香港生物科技研究院 (PA231),22.422664,114.214179,
64101F297D3C1C55,WATER SPORTS CENTRE (PA234),水上活動中心 (PA234),水上活动中心 (PA234),22.418662,114.214271,
5B39CC28607910E4,MA LIU SHUI PUBLIC PIER (PA237),馬料水公眾碼頭 (PA237),马料水公众码头 (PA237),22.416027,114.213945,
30D564180B68ECA8,TATE'S CAIRN TUNNEL (A2) (ST791),大老山隧道 (A2) (ST791),大老山隧道 (A2) (ST791),22.377526,114.212311,
F60CC440E22B0BD9,LEI YUE MUN PLAZA (LT600),鯉魚門廣場 (LT600),鲤鱼门广场 (LT600),22.296278,114.239716,
9274EF6791CA3ED8,TATE'S CAIRN TUNNEL (B1) (ST113),大老山隧道 (B1) (ST113),大老山隧道 (B1) (ST113),22.376864,114.211807,
34E1E68A3C2AFE81,WATER SPORTS CENTRE (PA102),水上活動中心 (PA102),水上活动中心 (PA102),22.420023,114.214250,
FB7E3001FDAB2CB1,TAI WO BUS TERMINUS (TP987),太和總站 (TP987),太和总站 (TP987),22.450314,114.161343,
5D6FB6C3F67A70DC,ON CHEUNG ROAD TAI PO (TP536),大埔安祥路 (TP536),大埔安祥路 (TP536),22.452217,114.167469,
CAD1ABCBA72CF365,TAI PO MARKET (TP591),大埔墟 (TP591),大埔墟 (TP591),22.445794,114.167050,
340FB0AD1BF68951,WAN TAU TONG BUS TERMINUS (TP958),運頭塘總站 (TP958),运头塘总站 (TP958),22.442255,114.166547,
AF04BB6F5FFF4C45,UPTOWN PLAZA (TP321),新達廣場 (TP321),新达广场 (TP321),22.443407,114.169018,
A401ECF82924D465,BELAIR GARDEN (ST514),富豪花園 (ST514),富豪花园 (ST514),22.384604,114.198065,
AF47DA55FCC27679,TSANG TAI UK (ST523),曾大屋 (ST523),曾大屋 (ST523),22.375411,114.189055,
A432A047D1B0DD62,SUN TIN WAI ESTATE (ST773),新田圍邨 (ST773),新田围邨 (ST773),22.370698,114.189159,
3ECFE1DBB01159EF,KAI YIP BUS TERMINUS (KT901),啟業總站 (KT901),启业总站 (KT901),22.328702,114.208719,
F1ED37F1BA6D054F,NGAU CHI WAN BBI-HUNG NGOK HOUSE (WT708),牛池灣轉車站-紅萼樓 (WT708),牛池湾转车站-红萼楼 (WT708),22.337035,114.206039,
3C34422AC69920E7,KAI CHEUNG COURT (WT976),啟翔苑 (WT976),启翔苑 (WT976),22.337851,114.203078,
E47CD422B33E5BE7,DIAMOND HILL STATION (WT710),鑽石山站 (WT710),钻石山站 (WT710),22.339356,114.201903,
99440967B8390837,WONG TAI SIN BBI-WONG TAI SIN TEMPLE (WT718),黃大仙轉車站-黃大仙廟 (WT718),黄大仙转车站-黄大仙庙 (WT718),22.341481,114.194301,
BE4DB8D578A94BEF,MORSE PARK SWIMMING POOL (WT721),摩士公園泳池 (WT721),摩士公园泳池 (WT721),22.341570,114.191604,
B0D6494AF630229A,SUN TIN WAI ESTATE (ST101),新田圍邨 (ST101),新田围邨 (ST101),22.368914,114.187352,
8A12C30EE2545583,KOWLOON BAY BUS TERMINUS (KT907),九龍灣總站 (KT907),九龙湾总站 (KT907),22.321940,114.207920,
FC343F5E57B07FBE,KAI CHEUNG COURT (WT975),啟翔苑 (WT975),启翔苑 (WT975),22.337880,114.203209,
E89B2315750AB2FD,CHI LIN NUNNERY (WT132),志蓮淨苑 (WT132),志莲净苑 (WT132),22.339948,114.204260,
F48CA8BC4044E42A,DIAMOND HILL STATION BUS TERMINUS (WT966),鑽石山站巴士總站 (WT966),钻石山站巴士总站 (WT966),22.340844,114.201671,
7BECB2120CD69543,TAI PO CENTRAL BUS TERMINUS (TP904),大埔中心總站 (TP904),大埔中心总站 (TP904),22.453155,114.169219,
5734545592215022,KWONG FUK ROAD BBI (Y2) (TP565),廣福道轉車站 (Y2) (TP565),广福道转车站 (Y2) (TP565),22.448421,114.167654,
81C6D8E74259157E,SHEUNG YEE ROAD (KT135),常怡道 (KT135),常怡道 (KT135),22.321028,114.207722,
53FC6F95C61542C1,KWUN TONG FERRY (KT938),觀塘碼頭 (KT938),观塘码头 (KT938),22.307560,114.221771,
060699911C9E300F,KOWLOON BAY STATION (EKCC) (KT320),九龍灣站(東九文化中心) (KT320),九龙湾站(东九文化中心) (KT320),22.325434,114.214338,
136E2FF5A3A98495,NGAU TAU KOK STATION (KT337),牛頭角站 (KT337),牛头角站 (KT337),22.315168,114.219594,
B644204AEDE7A031,FO YIN ROAD (PA215),科研路 (PA215),科研路 (PA215),22.426442,114.208450,
C3313FB0649BBD41,KWUN TONG FERRY (KT940),觀塘碼頭 (KT940),观塘码头 (KT940),22.307459,114.221842,
42AF8D1ADA2FA6C0,apm MILLENNIUM CITY 5 (KT624),apm創紀之城5期 (KT624),apm创纪之城5期 (KT624),22.312134,114.224992,
C9A46DDC082BAEE0,KWUN TONG BBI - MILLENNIUM CITY (KT643),觀塘轉車站 - 創紀之城 (KT643),观塘转车站 - 创纪之城 (KT643),22.314351,114.220671,
31852497A98F4A15,TELFORD GARDENS (KT664),德福花園 (KT664),德福花园 (KT664),22.322570,114.214311,
1001A444985DA59D,KWUN TONG FERRY (KT939),觀塘碼頭 (KT939),观塘码头 (KT939),22.307505,114.221804,
4167D2781EB3027C,THE EDUCATION UNIVERSITY OF HK (TP892),香港教育大學 (TP892),香港教育大学 (TP892),22.466682,114.193577,
94A3E9298FD887C6,TAI PO MARKET STATION BUS TERMINUS (TP942),大埔墟站巴士總站 (TP942),大埔墟站巴士总站 (TP942),22.443704,114.169069,
9DF152ED984CD4A0,PO HEUNG STREET TAI PO (TP300),大埔寶鄉街 (TP300),大埔宝乡街 (TP300),22.448103,114.166252,
DA9843B8F12ED700,THE EDUCATION UNIVERSITY OF HK (TP893),香港教育大學 (TP893),香港教育大学 (TP893),22.466682,114.193577,
CBC1B13E6C660F57,YU ON STREET SAM MUN TSAI (TP690),三門仔漁安街 (TP690),三门仔渔安街 (TP690),22.459545,114.204970,
D9803113E5547E6A,SHUEN WAN TYPHOON SHELTER (TP691),船灣避風塘 (TP691),船湾避风塘 (TP691),22.457129,114.209575,
955D67F4E8E6F94D,SHA LAN ROAD (TP692),沙欄路 (TP692),沙栏路 (TP692),22.457328,114.210827,
7F57D17DA2586C52,SAM MUN TSAI (TP710),三門仔 (TP710),三门仔 (TP710),22.456857,114.213781,
BC008DCE1FFF4A6D,SHA LAN ROAD (TP711),沙欄路 (TP711),沙栏路 (TP711),22.457193,114.210517,
DAF2564A31FDC4F0,SHUEN WAN TYPHOON SHELTER (TP712),船灣避風塘 (TP712),船湾避风塘 (TP712),22.457043,114.209298,
6EE5FF32091CF94A,YU ON STREET SAM MUN TSAI (TP713),三門仔漁安街 (TP713),三门仔渔安街 (TP713),22.458706,114.205479,
27F96537744C6792,HONG KONG SCIENCE PARK PHASE 3 (PA116),香港科學園第三期 (PA116),香港科学园第三期 (PA116),22.426589,114.209304,
ABF9301D1E5B52ED,"TING FU STREET, KWUN TONG (KT651)",觀塘定富街 (KT651),观塘定富街 (KT651),22.316772,114.215491,
8C79BE154468AE21,TELFORD GARDENS (KT665),德福花園 (KT665),德福花园 (KT665),22.322703,114.214288,
AA5CBDB0758443A9,WO HOP SHEK (ND883),和合石 (ND883),和合石 (ND883),22.482439,114.143218,
A7274154A935CF21,WONG SHEK HOUSE (KT310),黃石樓 (KT310),黄石楼 (KT310),22.331536,114.209206,
9C017F48CAD40F0B,DAI FU STREET TAI PO (TP765),大埔大富街 (TP765),大埔大富街 (TP765),22.461137,114.186139,
8E86CA255AAAEDE2,DAI SHUN STREET TAI PO (TP766),大埔大順街 (TP766),大埔大顺街 (TP766),22.459262,114.185077,
0BB3ECAB031F27CD,TAI PO MARKET STATION BUS TERMINUS (TP943),大埔墟站巴士總站 (TP943),大埔墟站巴士总站 (TP943),22.443622,114.169046,
C4A9CDF5F3CD6C30,DAI FU STREET TAI PO (TP670),大埔大富街 (TP670),大埔大富街 (TP670),22.459747,114.184736,
CE1380BFFD6A8A9B,DAI SHUN STREET TAI PO (TP671),大埔大順街 (TP671),大埔大顺街 (TP671),22.461396,114.186353,
C67CDF76A28A4E0E,FU SHIN BUS TERMINUS (TP966),富善總站 (TP966),富善总站 (TP966),22.453943,114.174843,
8C21D2D96DA6D045,TAI PO CENTRAL BUS TERMINUS (TP908),大埔中心總站 (TP908),大埔中心总站 (TP908),22.453294,114.169018,
A47A663F7AF92B77,KWONG FUK ROAD BBI - PLOVER COVE GARDEN (Z1),廣福道轉車站 - 寶湖花園 (Z1),广福道转车站 - 宝湖花园 (Z1),22.448942,114.168353,
D7D25DCF873DAE7A,KWONG FUK MARKET (TP552),廣福街市 (TP552),广福街市 (TP552),22.448743,114.174700,
3114213F8975F536,TATE'S CAIRN TUNNEL (A3) (ST790),大老山隧道 (A3) (ST790),大老山隧道 (A3) (ST790),22.377471,114.212368,
90B75A8D2983AC20,"SZE MEI STREET, SAN PO KONG (WT544)",新蒲崗四美街 (WT544),新蒲岗四美街 (WT544),22.338318,114.200764,
AA2D8DCDD78651B0,WONG TAI SIN BBI-WONG TAI SIN TEMPLE (WT717),黃大仙轉車站-黃大仙廟 (WT717),黄大仙转车站-黄大仙庙 (WT717),22.341479,114.194399,
9A83CAB8FB930EEE,LOK FU RECREATION GROUND (WT625),樂富遊樂場 (WT625),乐富游乐场 (WT625),22.337317,114.187009,
5D01986FB5E538CC,FUK LO TSUN ROAD (KC251),福佬村道 (KC251),福佬村道 (KC251),22.327586,114.187859,
C72D7C053FC3AEBB,KOWLOON CITY FERRY BUS TERMINUS (KC950),九龍城碼頭巴士總站 (KC950),九龙城码头巴士总站 (KC950),22.318573,114.193554,
AD78D43BCE88067A,LOK SHAN ROAD (KC765),落山道 (KC765),落山道 (KC765),22.317082,114.190539,
967B80D5CA41A8A8,NGAN HON STREET (KC768),銀漢街 (KC768),银汉街 (KC768),22.314978,114.188539,
4B03758AF99951A6,SHANSI STREET,山西街,山西街,22.313660,114.186954,
924FE4A6F2501116,YAU POK ROAD LIGHT PUBLIC HOUSING (SOUTH) TERMINUS,攸壆路簡約公屋 (南) 總站,攸壆路简约公屋 (南) 总站,22.475606,114.050757,
AAC74D0FACCF8639,YAU POK ROAD LIGHT PUBLIC HOUSING (NORTH) TERMINUS,攸壆路簡約公屋 (北) 總站,攸壆路简约公屋 (北) 总站,22.479289,114.052867,
3106E04BB81D74A8,SAN TIN PUBLIC TRANSPORT INTERCHANGE (YL995),新田運輸交匯處 (YL995),新田运输交汇处 (YL995),22.503140,114.082376,
8717C0140C940AE3,TAI TAU LENG (ND100),大頭嶺 (ND100),大头岭 (ND100),22.502310,114.123417,
31005C82D70F6B09,CHOI PIK HOUSE CHOI PO COURT (ND105),彩蒲苑彩碧閣 (ND105),彩蒲苑彩碧阁 (ND105),22.502927,114.124698,
3FAC6C2592812331,SHEUNG SHUI BBI - SHEUNG SHUI STATION(D1) (ND107),上水轉車站 - 上水站(D1),上水转车站 - 上水站(D1),22.500883,114.127921,
4E655B25ABAE103A,SHEUNG SHUI BBI - SHEUNG SHUI STATION(C1) (ND430),上水轉車站 - 上水站(C1),上水转车站 - 上水站(C1),22.501272,114.127302,
AD4E0E8DC8ACEFB6,CHOI PIK HOUSE CHOI PO COURT (ND432),彩蒲苑彩碧閣 (ND432),彩蒲苑彩碧阁 (ND432),22.502456,114.125148,
DF8F6AA868615D47,CHOI NGAN HOUSE CHOI PO COURT (ND436),彩蒲苑彩顏閣 (ND436),彩蒲苑彩颜阁 (ND436),22.501266,114.123741,
FFFB0F940CA7BEA7,SAN TIN PUBLIC TRANSPORT INTERCHANGE (YL540),新田運輸交匯處 (YL540),新田运输交汇处 (YL540),22.503206,114.081965,
ED758B6955F44E30,FAIRVIEW PARK (YL428),錦繡花園 (YL428),锦绣花园 (YL428),22.472741,114.055239,
4D258A35FECA3A0C,CHUK YUEN TSUEN (YL429),竹園村 (YL429),竹园村 (YL429),22.475901,114.056449,
A068B6BB68299035,YAU POK ROAD LIGHT PUBLIC HOUSING (NORTH) TERMINUS,攸壆路簡約公屋 (北) 總站,攸壆路简约公屋 (北) 总站,22.479314,114.052982,
B32FA6CD250F0F6B,CHING HO ESTATE BUS TERMINUS (ND936),清河邨總站 (ND936),清河邨总站 (ND936),22.495159,114.128471,
FF50570BA54BCA0B,NG UK VILLAGE (ND405),吳屋村 (ND405),吴屋村 (ND405),22.496610,114.127554,
BCD8ECF368228B0B,FAN KAM ROAD (ND190),粉錦公路 (ND190),粉锦公路 (ND190),22.499340,114.122500,
FB073A84B18E9339,CHUNG PAK LONG (ND191),松柏朗 (ND191),松柏朗 (ND191),22.501355,114.117042,
7B0FD0608D0C1A49,KAM TSIN (ND192),金錢 (ND192),金钱 (ND192),22.502502,114.113391,
86916B1ED459ED05,HANG TAU (ND193),坑頭 (ND193),坑头 (ND193),22.503521,114.107015,
2504CBB82DE653FB,KWU TUNG (ND194),古洞 (ND194),古洞 (ND194),22.501919,114.102447,
7C6DEBE9645872B0,KWU TUNG MARKET SHOPPING CENTRE (ND195),古洞街市 (ND195),古洞街市 (ND195),22.502262,114.098151,
948262F591F8E064,"PAK SHEK AU, EUROPA GARDEN (ND196)",白石凹-歐意花園 (ND196),白石凹-欧意花园 (ND196),22.503211,114.095261,
80F4C3404A0DE1BF,PAK SHEK AU INTERCHANGE (YL197),白石凹交匯處 (YL197),白石凹交汇处 (YL197),22.502795,114.085668,
8F7FBDE15F40FA1F,KI LUN TSUEN (YL198),麒麟村 (YL198),麒麟村 (YL198),22.500237,114.082077,
4DF38C902BCB29BB,SAN TIN BARRACKS (YL199),新田軍營 (YL199),新田军营 (YL199),22.496841,114.079492,
68C988CE5394BAE7,SAN TIN (YL435),新田 (YL435),新田 (YL435),22.498598,114.077945,
D2E1E2F33F06AF9F,SAN TIN (YL542),新田 (YL542),新田 (YL542),22.497731,114.076853,
B0F633D0FAFF5C83,SHEK WU WAI (YL543),石湖圍 (YL543),石湖围 (YL543),22.495102,114.072797,
0666986BDDA0F66A,MAI PO LUNG (YL544),米埔隴 (YL544),米埔陇 (YL544),22.495830,114.068404,
96B631E491E868BF,MAI PO (YL545),米埔 (YL545),米埔 (YL545),22.493252,114.061480,
62A946B36A5A5395,MAPLE GARDEN (YL550),碧豪花園 (YL550),碧豪花园 (YL550),22.486649,114.059029,
18B7CC82C10AFF50,NGAU TAM MEI (YL551),牛潭尾 (YL551),牛潭尾 (YL551),22.482404,114.058598,
AB7AB391AA272954,YAU TAM MEI TSUEN (YL552),攸潭尾村 (YL552),攸潭尾村 (YL552),22.480731,114.058496,
5DCEA4F4F314C99D,CHUK YUEN (YL553),竹園 (YL553),竹园 (YL553),22.475920,114.057187,
773A107C2AE6DEC3,SAN WAI TSUEN (YL554),新圍村 (YL554),新围村 (YL554),22.472631,114.056240,
C6D0AD0AA59CB197,LONG HA (YL555),朗廈 (YL555),朗厦 (YL555),22.469639,114.055544,
75BCC884A3620498,POK WAI (YL556),壆圍 (YL556),壆围 (YL556),22.464859,114.054199,
D2FCC678B1D160E1,MO FAN HEUNG (YL557),模範鄉 (YL557),模范乡 (YL557),22.462004,114.053360,
217E82F6FF3F89E3,FUNG KAT HEUNG (YL558),逢吉鄉 (YL558),逢吉乡 (YL558),22.457612,114.052413,
BF598D4B90407BB9,SHA PO TSUEN (YL559),沙埔村 (YL559),沙埔村 (YL559),22.452722,114.050990,
72B24F5DD57E3AE3,LONG PING ESTATE BUS TERMINUS (YL925),朗屏邨總站 (YL925),朗屏邨总站 (YL925),22.450382,114.022806,
CA9E9870D7B2FF36,WAH MING BBI(C2) (ND989),華明轉車站(C2) (ND989),华明转车站(C2) (ND989),22.484557,114.141194,
FA7A3D77713061E9,YAN SHING COURT (ND396),欣盛苑 (ND396),欣盛苑 (ND396),22.487197,114.140384,
C7120BD9A94B4F6A,FANLING STATION BBI-FUNG YING SEEN KOON(D2),粉嶺站轉車站 - 蓬瀛仙館 (D2),粉岭站转车站 - 蓬瀛仙馆 (D2),22.491045,114.138414,
825199DC3BC0C5A3,KEI SAN SECONDARY SCHOOL (ND399),基新中學 (ND399),基新中学 (ND399),22.490943,114.135133,
A8F178C255CF9783,CHI FUK CIRCUIT FANLING (ND411),粉嶺置福圍 (ND411),粉岭置福围 (ND411),22.493251,114.136205,
ADB9356BBF06F7C7,KA SHING COURT (ND401),嘉盛苑 (ND401),嘉盛苑 (ND401),22.492093,114.133240,
8E3F5AE0A97053F9,GLAMOUR GARDEN (ND403),華慧園 (ND403),华慧园 (ND403),22.495493,114.130967,
4EE417C5EF5FEF4E,HI LEE PATH YUEN LONG (YL364),元朗喜利徑 (YL364),元朗喜利径 (YL364),22.444659,114.025457,
4E2EC89B41600D7E,YOHO MALL II (YL395),形點 II (YL395),形点 II (YL395),22.446662,114.034928,
0492DA388B6FDA92,SHA PO TSUEN (YL423),沙埔村 (YL423),沙埔村 (YL423),22.451451,114.050045,
1F5D9F81AB034CAE,FUNG KAT HEUNG (YL424),逢吉鄉 (YL424),逢吉乡 (YL424),22.457859,114.051691,
E329DEA067F8BF02,MO FAN HEUNG (YL425),模範鄉 (YL425),模范乡 (YL425),22.460452,114.052537,
14FDBB259636B76C,POK WAI (YL426),壆圍 (YL426),壆围 (YL426),22.462929,114.053126,
B13D9345C84F088E,TAI SANG WAI (YL427),大生圍 (YL427),大生围 (YL427),22.469176,114.054518,
89B3AC12AE89FA58,NGAU TAM MEI (YL430),牛潭尾 (YL430),牛潭尾 (YL430),22.480559,114.057672,
95D8C212AC184184,PALM SPRINGS (YL431),加州花園 (YL431),加州花园 (YL431),22.486448,114.058411,
A33FBDE702CC3CEE,MAI PO (YL432),米埔 (YL432),米埔 (YL432),22.493225,114.061457,
75CC4D05BE8B68E7,MAI PO LUNG (YL433),米埔隴 (YL433),米埔陇 (YL433),22.495804,114.068475,
8CBD3CC8254E5BCA,SHEK WU WAI (YL434),石湖圍 (YL434),石湖围 (YL434),22.495296,114.073541,
B0D79D5CE512B9EC,SAN TIN (YL436),新田 (YL436),新田 (YL436),22.498653,114.078024,
103661C9BABD79FD,SAN TIN PUBLIC TRANSPORT INTERCHANGE (YL437),新田運輸交匯處 (YL437),新田运输交汇处 (YL437),22.503353,114.081900,
11D6E70354E28F88,CHAU TAU (YL575),洲頭 (YL575),洲头 (YL575),22.503915,114.085496,
BD1949B34937A7C6,PAK SHEK AU INTERCHANGE (ND576),白石凹交匯處 (ND576),白石凹交汇处 (ND576),22.504451,114.087588,
