stop,name_en,name_tc,name_sc,lat,long,data_timestamp
DB22EE221876DD43,"MONG KOK EAST STATION, MOKO (MK905)",旺角東站 MOKO (MK905),旺角东站 MOKO (MK905),22.322613,114.172230,
3CAE3C9F0D263D94,WAH MING ESTATE BUS TERMINUS(A1) (ND980),華明邨總站(A1) (ND980),华明邨总站(A1) (ND980),22.484376,114.140963,
4C97BE87FBF959C4,PAK FUK TIN SUM PLAYGROUND (ND150),百福田心球場 (ND150),百福田心球场 (ND150),22.488346,114.140923,
18785E68EAD3D9B8,CHOI YUEN BUS TERMINUS (ND922),彩園總站 (ND922),彩园总站 (ND922),22.500849,114.125625,
D97A36CE8D65B198,"TAI PING BUS TERMINUS, NORTH DISTRICT HOSPITAL",太平總站-北區醫院 (ND927),太平总站-北区医院 (ND927),22.497528,114.125221,
8237ED597A8A948B,WAH MING BBI(C3) (ND988),華明轉車站(C3) (ND988),华明转车站(C3) (ND988),22.484467,114.141322,
E86A26B1A389C290,"TAI PING BUS TERMINUS, NORTH DISTRICT HOSPITAL",太平總站-北區醫院 (ND926),太平总站-北区医院 (ND926),22.497528,114.125221,
08A46530B241544D,ELEGANTIA COLLEGE (ND422),風釆中學 (ND422),风采中学 (ND422),22.493610,114.124466,
017BCFA7DC246519,ELEGANTIA COLLEGE (ND421),風釆中學 (ND421),风采中学 (ND421),22.493441,114.124477,
583E102838FA4D0A,CHING HO ESTATE BUS TERMINUS (ND935),清河邨總站 (ND935),清河邨总站 (ND935),22.494584,114.128190,
9CA76C3AEAB52DC2,SHEUNG SHUI BBI - SHEUNG SHUI STATION(B2) (ND483),上水轉車站 - 上水站(B2),上水转车站 - 上水站(B2),22.502100,114.127258,
C65C38558F2F978B,TAI WO BUS TERMINUS (TP982),太和總站 (TP982),太和总站 (TP982),22.450999,114.160942,
C289F0DD208B531D,WAN TAU TONG BUS TERMINUS (TP957),運頭塘總站 (TP957),运头塘总站 (TP957),22.442252,114.166669,
4A35BB617F75F41D,SHEUNG SHUI BBI - SHEUNG SHUI TERMINUS (A3),上水轉車站 - 上水總站(A3),上水转车站 - 上水总站(A3),22.502573,114.127769,
B9B740E8C5E027BB,FANLING (FAI MING ROAD) (ND995),粉嶺(暉明路) (ND995),粉岭(晖明路) (ND995),22.482008,114.137950,
DDC8BA73EDCE6705,CHEONG SHING COURT (ND161),昌盛苑 (ND161),昌盛苑 (ND161),22.483813,114.139244,
305B120AF37FE8BD,HANG TAI ROAD (MA361),恆泰路 (MA361),恒泰路 (MA361),22.410169,114.222870,
E22B819E638307CC,WU KAI SHA STATION (MA986),烏溪沙站 (MA986),乌溪沙站 (MA986),22.428420,114.244017,
5ED989C30DF49DE4,MA ON SHAN TOWN CENTRE (MA311),馬鞍山市中心 (MA311),马鞍山市中心 (MA311),22.424542,114.231544,
D055CA5BAD9EEF5E,KWONG FUK ESTATE (TP266),廣福邨　 (TP266),广福邨　 (TP266),22.446299,114.173076,
D517E296CB051677,PLOVER COVE COUNTRY PARK (TP641),船灣郊野公園 (TP641),船湾郊野公园 (TP641),22.480322,114.240584,
87723BB571C3E7BD,CHUNG PUI (TP642),涌背 (TP642),涌背 (TP642),22.485586,114.243338,
A6AE2448FFB2CCF3,CHUNG PUI BARBECUE SITE (TP643),涌背燒烤場 (TP643),涌背烧烤场 (TP643),22.486993,114.243896,
29831C0D4D930225,CHUNG MEI BARBECUE SITE (TP644),涌尾燒烤場 (TP644),涌尾烧烤场 (TP644),22.494631,114.241292,
5ABB7576D1BAC0E7,BRIDE'S POOL (TP645),新娘潭 (TP645),新娘潭 (TP645),22.502354,114.237253,
88AC366AD0AEF0BF,CHI SUM ROAD (TP646),祠心路 (TP646),祠心路 (TP646),22.507073,114.241219,
4592EF85D20AB0E0,WU KAU TANG BUS TERMINUS (TP880),烏蛟騰總站 (TP880),乌蛟腾总站 (TP880),22.505914,114.241791,
24C3C62F633948AD,BRIDE'S POOL (TP700),新娘潭 (TP700),新娘潭 (TP700),22.502865,114.236979,
79AB35C49EC6A4A9,CHUNG MEI BARBECUE SITE (TP701),涌尾燒烤場 (TP701),涌尾烧烤场 (TP701),22.493714,114.241668,
F31B9B0CD79FCC8F,CHUNG PUI BARBECUE SITE (TP702),涌背燒烤場 (TP702),涌背烧烤场 (TP702),22.489052,114.242227,
16C01C6D1E671ED7,CHUNG PUI (TP703),涌背 (TP703),涌背 (TP703),22.481839,114.241782,
819BDBC902E323E0,PLOVER COVE COUNTRY PARK (TP704),船灣郊野公園 (TP704),船湾郊野公园 (TP704),22.478913,114.238921,
2A35C305E68FCD65,"HUNG HOM (HUNG LUEN ROAD), KERRY HOTEL (HH906)",紅磡(紅鸞道) 嘉里酒店 (HH906),红磡(红鸾道) 嘉里酒店 (HH906),22.301743,114.188848,
4BE4E6D4F5A06A51,YIU MAN HOUSE TIN YIU ESTATE (TN581),天耀邨耀民樓 (TN581),天耀邨耀民楼 (TN581),22.449714,114.003125,
D747ADD80335605C,TUNG LOK STREET YUEN LONG (YL370),元朗同樂街 (YL370),元朗同乐街 (YL370),22.444616,114.028298,
F0FB5EC850A66722,SHEUNG SHUI BBI - SHEUNG SHUI TERMINUS (A5),上水轉車站 - 上水總站(A5),上水转车站 - 上水总站(A5),22.502744,114.127704,
A22733425D08E68A,TIN HENG ESTATE BUS TERMINUS (TN971),天恆邨總站 (TN971),天恒邨总站 (TN971),22.469439,113.999680,
5501654D47E432D4,"TAI PING BUS TERMINUS, NORTH DISTRICT HOSPITAL",太平總站-北區醫院 (ND929),太平总站-北区医院 (ND929),22.497940,114.125292,
430C6E88A93B42DE,TIN FU BUS TERMINUS (TN961),天富總站 (TN961),天富总站 (TN961),22.462304,113.998496,
26A1D2969A15C3AF,CHOI YUEN BUS TERMINUS (ND921),彩園總站 (ND921),彩园总站 (ND921),22.500924,114.125620,
E7057BF64CF7D89D,YOHO MALL I (YL240),形點 I (YL240),形点 I (YL240),22.444324,114.035984,
65F591143DC7CF9C,TAI KIU TSUEN YUEN LONG (YL216),元朗大橋村 (YL216),元朗大桥村 (YL216),22.447448,114.026847,
023F856BE4F830F2,SHEK PO TSUEN (YL583),石埗村 (YL583),石埗村 (YL583),22.440095,113.998348,
D2C1454B663392C9,FANLING HIGHWAY BBI (A1) (TP102),粉嶺公路轉車站 (A1) (TP102),粉岭公路转车站 (A1) (TP102),22.484598,114.152902,
A88EE1930BE82C54,LAM TIN STATION (ALIGHTING STOP) (LT901),藍田站 (落客站) (LT901),蓝田站 (落客站) (LT901),22.307801,114.233406,
5D7809204099960C,LAM TIN STATION (LT902),藍田站 (LT902),蓝田站 (LT902),22.306615,114.233961,
64303D83BDF8C92F,apm MILLENNIUM CITY 5 (KT623),apm創紀之城5期 (KT623),apm创纪之城5期 (KT623),22.312048,114.225078,
26AC17B8F05DD7F2,SHEUNG SHUI BBI - SHEUNG SHUI STATION(B1) (ND484),上水轉車站 - 上水站(B1),上水转车站 - 上水站(B1),22.502171,114.127188,
87549D6B12E322E5,LAM TIN STATION (LT904),藍田站 (LT904),蓝田站 (LT904),22.306866,114.233746,
5774E63B634C0B1E,LAM TIN STATION (LT903),藍田站 (LT903),蓝田站 (LT903),22.306701,114.233898,
7EFB60ED247B4316,LUEN WO HUI BUS TERMINUS (ND968),聯和墟總站 (ND968),联和墟总站 (ND968),22.500346,114.143625,
D585080E071B999E,LUEN WO HUI BUS TERMINUS (ND964),聯和墟總站 (ND964),联和墟总站 (ND964),22.500346,114.143625,
F2EDDDB17B1EA974,NINA TOWER BUS TERMINUS (TW956),如心廣場巴士總站 (TW956),如心广场巴士总站 (TW956),22.368183,114.112542,
1AB800949FF1203B,LUEN WO HUI BUS TERMINUS (ND961),聯和墟總站 (ND961),联和墟总站 (ND961),22.500346,114.143625,
B28798C421AB2D6B,UNION PLAZA (ND560),海聯廣場 (ND560),海联广场 (ND560),22.500489,114.142725,
D4C4D9175A19C230,WAH MING BBI(C5) (ND986),華明轉車站(C5) (ND986),华明转车站(C5) (ND986),22.484350,114.141503,
81657B3B0CB3D4C0,SHEUNG SHUI BBI - SHEUNG SHUI TERMINUS (A3),上水轉車站 - 上水總站(A3),上水转车站 - 上水总站(A3),22.502607,114.127861,
AA1572E26F6BCA34,NINA TOWER BUS TERMINUS (TW955),如心廣場巴士總站 (TW955),如心广场巴士总站 (TW955),22.368183,114.112542,
716E50EBD1CD72B4,TSING YI STATION (TY927),青衣站 (TY927),青衣站 (TY927),22.359820,114.107082,
777B5D8A34B8F690,WO HOP SHEK (ND881),和合石 (ND881),和合石 (ND881),22.482439,114.143218,
32EDA7D330FF6CA1,TSING YI BBI - CHING WANG COURT(C1) (TY200),青衣轉車站 –青宏苑 (C1),青衣转车站 –青宏苑 (C1),22.361292,114.104436,
401F11E257E35078,FO TAN CHUN YEUNG ESTATE (FT933),火炭駿洋邨 (FT933),火炭骏洋邨 (FT933),22.399154,114.190288,
59A591C17AEB1AF6,FO TAN (SHAN MEI STREET) BUS TERMINUS (FT954),火炭(山尾街)總站 (FT954),火炭(山尾街)总站 (FT954),22.396525,114.194300,
7EC5C567E35D2805,TSING SHA HIGHWAY BBI (B2) (TA295),青沙公路轉車站 (B2) (TA295),青沙公路转车站 (B2) (TA295),22.360716,114.162966,
EAA44CDBC231DB8C,KWONG YUEN BUS TERMINUS (ST884),廣源巴士總站 (ST884),广源巴士总站 (ST884),22.381186,114.216028,
9B908B19CE774219,CITY ONE SHA TIN BUS TERMINUS (ST707),第一城總站 (ST707),第一城总站 (ST707),22.386051,114.202508,
9B45E50457274D2F,KOWLOON STATION BUS TERMINUS (YT945),九龍站巴士總站 (YT945),九龙站巴士总站 (YT945),22.305015,114.162893,
FED9D9183EFFF2F6,SHATIN CENTRAL BUS TERMINUS (ST919),沙田市中心總站 (ST919),沙田市中心总站 (ST919),22.382223,114.188308,
9CCAA319B4354EC6,SHATIN CENTRAL BUS TERMINUS (ST921),沙田市中心總站 (ST921),沙田市中心总站 (ST921),22.381882,114.187999,
5C63A2B4F457D344,MEI TIN BUS TERMINUS (TA974),美田巴士總站 (TA974),美田巴士总站 (TA974),22.376324,114.170565,
F2E381299EA74E3E,MEI LAM BUS TERMINUS (TA962),美林巴士總站 (TA962),美林巴士总站 (TA962),22.377598,114.175121,
6FE6F7EBD604054A,SHATIN CENTRAL BUS TERMINUS (ST918),沙田市中心總站 (ST918),沙田市中心总站 (ST918),22.382335,114.188415,
54275D88AD8679D4,RAVANA GARDEN (ST155),濱景花園 (ST155),滨景花园 (ST155),22.391735,114.205886,
B50DB83AC82D3C44,FO TAN CHUN YEUNG ESTATE (FT932),火炭駿洋邨 (FT932),火炭骏洋邨 (FT932),22.399154,114.190288,
C8F8183B3AFC9383,FO TAN STATION (FT940),火炭站 (FT940),火炭站 (FT940),22.395417,114.197500,
032E4C7E0B1B7298,WO LIU HANG ROAD (FT510),禾寮坑路 (FT510),禾寮坑路 (FT510),22.396870,114.196257,
B1A047E011F022D2,LEE ON BUS TERMINUS (MA972),利安巴士總站 (MA972),利安巴士总站 (MA972),22.425362,114.240824,
9100CA704DC2D403,CHEUNG SHA WAN (HOI TAT ESTATE) BUS TERMINUS,長沙灣(海達邨)總站 (SS954),长沙湾(海达邨)总站 (SS954),22.329103,114.150978,
BA4AAEE586402CD4,TSING SHA HIGHWAY BBI (B3) (TA294),青沙公路轉車站 (B3) (TA294),青沙公路转车站 (B3) (TA294),22.360632,114.162925,
9D9323892E6ACB20,SHEK MUN ESTATE (ST490),碩門邨 (ST490),硕门邨 (ST490),22.387829,114.209182,
0C44F4B0A1D12636,KAM TAI COURT (MA131),錦泰苑 (MA131),锦泰苑 (MA131),22.408730,114.220556,
77B8325F08F1FFAA,SHAM SHUI PO POLICE STATION (SS711),深水埗警署 (SS711),深水埗警署 (SS711),22.330275,114.159488,
69BBC65EA7215C8F,HIN KENG BUS TERMINUS (TA935),顯徑巴士總站 (TA935),显径巴士总站 (TA935),22.362759,114.170962,
708513C4DCB8EE4E,HIN YIU ESTATE (TA570),顯耀邨 (TA570),显耀邨 (TA570),22.367567,114.175147,
C24D0D91E47E942E,SHAM SHUI PO (YEN CHOW STREET) (SS974),深水埗(欽州街) (SS974),深水埗(钦州街) (SS974),22.331051,114.159891,
3E10F323161F4ADB,UNIVERSITY STATION (ST901),大學站 (ST901),大学站 (ST901),22.412599,114.211231,
8AD4B244D6A50BDB,GO PARK SAI SHA (SK205),西沙 GO PARK (SK205),西沙 GO PARK (SK205),22.427029,114.265792,
81E82A4D2A0D9BD3,SHUI CHUEN O BUS TERMINUS (ST971),水泉澳總站 (ST971),水泉澳总站 (ST971),22.374603,114.197701,
38CCA601583A5C55,YUET CHUEN HOUSE SHUI CHUEN O ESTATE (ST652),水泉澳邨月泉樓 (ST652),水泉澳邨月泉楼 (ST652),22.372738,114.196735,
DBF574C877BF4AC5,MONG KOK (PARK AVENUE) BUS TERMINUS (MK914),旺角(柏景灣)總站 (MK914),旺角(柏景湾)总站 (MK914),22.315878,114.163247,
66B8F73D3F4E91C9,POK HONG BUS TERMINUS (ST961),博康巴士總站 (ST961),博康巴士总站 (ST961),22.377224,114.195421,
C8649AADD889000A,SHUI CHUEN O (UPPER) BUS TERMINUS (ST980),水泉澳(上)總站 (ST980),水泉澳(上)总站 (ST980),22.368407,114.198298,
25B5D45256839700,YAN CHUEN HOUSE SHUI CHUEN O ESTATE (ST650),水泉澳邨欣泉樓 (ST650),水泉澳邨欣泉楼 (ST650),22.371752,114.198478,
F99B2D48663A322E,LONG CHUEN HOUSE SHUI CHUEN O ESTATE (ST651),水泉澳邨朗泉樓 (ST651),水泉澳邨朗泉楼 (ST651),22.372753,114.198561,
9879DF2CF2B69838,SHUI CHUEN O BUS TERMINUS (ST975),水泉澳總站 (ST975),水泉澳总站 (ST975),22.374743,114.197899,
6AEE9093F4E070AD,POK TAI HOUSE POK HONG ESTATE (ST656),博康邨博泰樓 (ST656),博康邨博泰楼 (ST656),22.377005,114.196158,
36A84C685395B7C9,SHA TIN CENTRAL (ST750),沙田市中心 (ST750),沙田市中心 (ST750),22.381824,114.188460,
5221837D08C7B586,LING CHUEN HOUSE SHUI CHUEN O ESTATE (ST241),水泉澳邨嶺泉樓 (ST241),水泉澳邨岭泉楼 (ST241),22.371145,114.198576,
888C8A612C998895,UNIVERSITY STATION (ST906),大學站 (ST906),大学站 (ST906),22.412733,114.210655,
25FB047753EFD115,HANG FAI STREET (MA150),恆輝街 (MA150),恒辉街 (MA150),22.414810,114.224406,
D9328F386A03DC36,PO TAI STREET (MA341),保泰街 (MA341),保泰街 (MA341),22.414210,114.223742,
84BAF05C529889BB,SHATIN CENTRAL BUS TERMINUS (ST914),沙田市中心總站 (ST914),沙田市中心总站 (ST914),22.382282,114.188281,
D9AAA33F19B8E45A,HANG HAU (NORTH)(TSEUNG KWAN O HOSPITAL) (TK952),坑口(北)(將軍澳醫院) (TK952),坑口(北)(将军澳医院) (TK952),22.317870,114.269229,
7E035AF141396291,PUI SHING ROAD (TK254),培成路 (TK254),培成路 (TK254),22.315282,114.263897,
45852CCBB75F4A68,SERENITY PLACE (TK129),怡心園 (TK129),怡心园 (TK129),22.323087,114.253528,
B37FC6600B2254B6,TSUEN WAN WEST STATION BUS TERMINUS (TW971),荃灣西站巴士總站 (TW971),荃湾西站巴士总站 (TW971),22.368157,114.110544,
3366C1DC458401B3,FINERY PARK (TK475),富麗花園 (TK475),富丽花园 (TK475),22.323122,114.253885,
21AD38E162AE7E57,CHOI MING BUS TERMINUS (TK915),彩明總站 (TK915),彩明总站 (TK915),22.305903,114.251711,
9D208FE6B2CFD450,TONG MING STREET PARK (TK107),唐明街公園 (TK107),唐明街公园 (TK107),22.310769,114.259045,
E51AC47DDDA21250,LOHAS PARK STATION (TK920),康城站 (TK920),康城站 (TK920),22.296239,114.268098,
F3209DBC2E7E5C1A,FIRE AND AMBULANCE SERVICES ACADEMY (TK542),消防及救護學院 (TK542),消防及救护学院 (TK542),22.305294,114.274675,
A1C5849926BE3289,PARK CENTRAL (TK563),將軍澳中心 (TK563),将军澳中心 (TK563),22.306245,114.257952,
E721A2E3853D636D,TSEUNG KWAN O - LAM TIN TUNNEL BBI (A2) (LT550),將藍隧道轉車站(A2) (LT550),将蓝隧道转车站(A2) (LT550),22.300330,114.231033,
E8A145669A392955,TSUEN WAN WEST STATION BUS TERMINUS (TW970),荃灣西站巴士總站 (TW970),荃湾西站巴士总站 (TW970),22.368086,114.110624,
BED3E96AAC2B3B3D,FIRE AND AMBULANCE SERVICES ACADEMY (TK543),消防及救護學院 (TK543),消防及救护学院 (TK543),22.305101,114.274640,
26F23B1B4A5AB703,TIU KENG LENG STATION (TK974),調景嶺站 (TK974),调景岭站 (TK974),22.304787,114.252229,
12B9E30ED892A35A,HONG KONG VELODROME (TK479),香港單車館 (TK479),香港单车馆 (TK479),22.313276,114.260687,
4E279C21A109E9E3,TIU KENG LENG (TK586),調景嶺 (TK586),调景岭 (TK586),22.305460,114.252883,
B75CD6E70417E21B,LE PRESTIGE LOHAS PARK (TK531),日出康城領都 (TK531),日出康城领都 (TK531),22.294224,114.273376,
471442D7E30D26EB,THE CAPITOL LOHAS PARK (TK533),日出康城首都 (TK533),日出康城首都 (TK533),22.296657,114.272705,
9D8BB8FABEAF218A,PO LAM BUS TERMINUS (TK926),寶林總站 (TK926),宝林总站 (TK926),22.322538,114.257922,
A9C847312AE9E37A,"SAI YEUNG CHOI STREET SOUTH, MONG KOK STATION",西洋菜南街 旺角站 (MK341),西洋菜南街 旺角站 (MK341),22.320174,114.169888,
403881982F9E7209,SHEUNG TAK BUS TERMINUS (TK967),尚德總站 (TK967),尚德总站 (TK967),22.311232,114.259499,
AB5CF1D729028A16,TONG MING STREET PARK (TK575),唐明街公園 (TK575),唐明街公园 (TK575),22.310463,114.259043,
5527FF8CC85CF139,SHEUNG TAK BUS TERMINUS (TK966),尚德總站 (TK966),尚德总站 (TK966),22.311180,114.259515,
77CDA845262FB8CF,CHEUNG SHA WAN (SHAM MONG ROAD) BUS TERMINUS,長沙灣(深旺道)總站 (SS665),长沙湾(深旺道)总站 (SS665),22.330638,114.149931,
2FE12E7B84CB20D4,HING WAH STREET WEST (BUS DEPOT) (SS670),興華街西(巴士廠) (SS670),兴华街西(巴士厂) (SS670),22.329790,114.145041,
6571D5C2A2184B8D,CHEUNG SHA WAN (HOI YING ESTATE) BUS TERMINUS,長沙灣(海盈邨) 總站 (SS914),长沙湾(海盈邨) 总站 (SS914),22.328104,114.148005,
F8A31970F2A8E25C,HING WAH STREET WEST (HOI YING ESTATE) (SS284),興華街西(海盈邨) (SS284),兴华街西(海盈邨) (SS284),22.329162,114.145445,
21E3E95EAEB2048C,SHEUNG TAK BUS TERMINUS (TK965),尚德總站 (TK965),尚德总站 (TK965),22.311099,114.259550,
2EC5A7EB9CA821D9,M+ (YT270),M+ (YT270),M+ (YT270),22.301568,114.158145,
C50C67D1BFF70DDF,HONG KONG PALACE MUSEUM (YT271),香港故宮文化博物館 (YT271),香港故宫文化博物馆 (YT271),22.301502,114.156253,
E459280CA121C86D,PO LAM BUS TERMINUS (TK932),寶林總站 (TK932),宝林总站 (TK932),22.323492,114.257579,
AA5DDEA5E49EB6B2,TSEUNG KWAN O SWIMMING POOL (TK485),將軍澳游泳池 (TK485),将军澳游泳池 (TK485),22.318259,114.258869,
8CCA633CFB594DC6,TONG MING STREET PARK (TK108),唐明街公園 (TK108),唐明街公园 (TK108),22.310793,114.259112,
988F4ACF3061743F,KWONG MING COURT (TK126),廣明苑 (TK126),广明苑 (TK126),22.313191,114.260334,
380109CCE17074A3,HAVEN OF HOPE HOSPITAL (TK135),靈實醫院 (TK135),灵实医院 (TK135),22.313982,114.257720,
C9C125980C6ADEAA,TSEUNG KWAN O SWIMMING POOL (TK150),將軍澳游泳池 (TK150),将军澳游泳池 (TK150),22.316397,114.260313,
AD4C1C7B2D1DF6FC,HANG HAU (NORTH)(TSEUNG KWAN O HOSPITAL) (TK955),坑口(北)(將軍澳醫院) (TK955),坑口(北)(将军澳医院) (TK955),22.317744,114.268925,
0F283CD99F7295F3,HANG HAU STATION (TK940),坑口站 (TK940),坑口站 (TK940),22.315311,114.264905,
F4E8B702E575BDA8,CHUNG MING COURT (TK282),頌明苑 (TK282),颂明苑 (TK282),22.317114,114.261217,
53A34B72EBF9858D,PO HONG PARK (TK155),寶康公園 (TK155),宝康公园 (TK155),22.319021,114.258332,
12332D6FD6163ED9,PO LAM BUS TERMINUS (TK933),寶林總站 (TK933),宝林总站 (TK933),22.323530,114.257546,
28AEFA619AAB9688,HANG HAU (NORTH) (TSEUNG KWAN O HOSPITAL) (TK956),坑口(北) (將軍澳醫院) (TK956),坑口(北) (将军澳医院) (TK956),22.317722,114.269074,
58A2321139358155,"HUNG HOM (HUNG LUEN ROAD), KERRY HOTEL (HH904)",紅磡(紅鸞道) 嘉里酒店 (HH904),红磡(红鸾道) 嘉里酒店 (HH904),22.301743,114.188848,
29F6FE2F0824FEAA,LEUNG KIT WAH PRIMARY SCHOOL (TK467),梁潔華小學 (TK467),梁洁华小学 (TK467),22.323402,114.255704,
CC2353289CD0EE66,FIRE AND AMBULANCE SERVICES ACADEMY (TK541),消防及救護學院 (TK541),消防及救护学院 (TK541),22.305370,114.274690,
F5B19145922F18CC,HANG HAU (NORTH)(TSEUNG KWAN O HOSPITAL) (TK953),坑口(北)(將軍澳醫院) (TK953),坑口(北)(将军澳医院) (TK953),22.317826,114.269182,
B00A32AD2E0DA209,HANG HAU STATION (TK943),坑口站 (TK943),坑口站 (TK943),22.315673,114.264483,
1223A35DAB7AE8B0,T.K.O. INDUSTRIAL EST. BUS TERMINUS (TK991),將軍澳工業邨巴士總站 (TK991),将军澳工业邨巴士总站 (TK991),22.283253,114.270398,
E3DF87A934DC95EE,WINGS AT SEA LOHAS PARK (TK330),日出康城晉海 (TK330),日出康城晋海 (TK330),22.291917,114.272205,
E8149C288DA7DF33,WINGS AT SEA LOHAS PARK (TK520),日出康城晉海 (TK520),日出康城晋海 (TK520),22.292169,114.272190,
2132577767F0056D,SHATIN CENTRAL BUS TERMINUS (ST911),沙田市中心總站 (ST911),沙田市中心总站 (ST911),22.382373,114.188294,
7547D90C500629AF,SAI KUNG BUS TERMINUS (SK905),西貢總站 (SK905),西贡总站 (SK905),22.382091,114.273817,
DAE04FEC0D09BED6,TSZ WAN SHAN (NORTH) BUS TERMINUS (WT953),慈雲山(北)總站 (WT953),慈云山(北)总站 (WT953),22.350989,114.198184,
246B32CF201C6A7A,TSZ WAN SHAN (CENTRAL) BUS TERMINUS (WT943),慈雲山(中)巴士總站 (WT943),慈云山(中)巴士总站 (WT943),22.348424,114.200342,
0D625148EFD58C10,PING SHEK ESTATE (WT305),坪石邨 (WT305),坪石邨 (WT305),22.333205,114.207167,
DBF0C952CAA654B5,EASTERN HARBOUR TUNNEL BBI (K2) (LT410),東隧轉車站 (K2) (LT410),东隧转车站 (K2) (LT410),22.300533,114.233650,
D2F2B3C5436007C2,ADMIRALTY CENTRE,海富中心,海富中心,22.279408,114.165369,
74EE2ECB1A3773E9,LI YUEN STREET EAST,利源東街,利源东街,22.283072,114.156844,
ED3477DD255C1DE7,RUMSEY STREET,林士街,林士街,22.286025,114.153476,
32F6057322483222,QUARRY BAY STREET,鰂魚涌街,鲗鱼涌街,22.284754,114.211976,
6B0BCBBF0D4F4033,TAIKOO PLACE,太古坊,太古坊,22.287079,114.210183,
3FDB920D421F74BA,MODEL HOUSING ESTATE,模範邨,模范邨,22.291550,114.207577,
09DFD305F09C558E,TAI PO CENTRAL BUS TERMINUS (TP903),大埔中心總站 (TP903),大埔中心总站 (TP903),22.453221,114.169240,
B8760F28D7938609,FENWICK STREET,分域街,分域街,22.279154,114.170943,
3225E407F87D904C,ADMIRALTY CENTRE,海富中心,海富中心,22.279438,114.165264,
78A74247AE9B466E,LI YUEN STREET EAST,利源東街,利源东街,22.283045,114.156867,
A95DD63E3A98FF7F,WING KUT STREET,永吉街,永吉街,22.285592,114.154192,
C360EB0956976C4D,CENTRAL FERRY PIER NO.3,中環三號碼頭,中环三号码头,22.287587,114.157308,
C1FC4F003C9031B3,CENTRAL (CENTRAL FERRY PIERS),中環渡輪碼頭,中环渡轮码头,22.286203,114.159814,
BD9D7DAC7CD2F537,RUMSEY STREET,林士街,林士街,22.286157,114.153596,
59073C1C6D8BB1F7,DOUGLAS STREET,德忌利士街,德忌利士街,22.283317,114.156864,
20554F51D1E03E33,IMMIGRATION TOWER,入境事務大樓,入境事务大楼,22.279454,114.173066,
DDEB0396969D004B,HING FAT STREET,興發街,兴发街,22.283420,114.191215,
991E47DBD416B908,EASTERN HARBOUR TUNNEL BBI (L2) (LT100),東隧轉車站 (L2) (LT100),东隧转车站 (L2) (LT100),22.300972,114.232741,
7F40151DA3492D5A,TAI PO TAU BUS TERMINUS (TP976),大埔頭總站 (TP976),大埔头总站 (TP976),22.454963,114.160745,
18624A8EBAB72722,FU HENG BUS TERMINUS (TP993),富亨總站 (TP993),富亨总站 (TP993),22.458315,114.171884,
325FDAE396B59480,SUN HING GARDEN (TP381),新興花園 (TP381),新兴花园 (TP381),22.452910,114.172626,
37A527C88AEA72AC,MUNSANG COLLEGE HK ISLAND,港島民生書院,港岛民生书院,22.283317,114.223718,
1FBB28693ED34F4C,TAI CHEONG STREET,太祥街,太祥街,22.283508,114.220710,
6EB240B51722FF5C,KORNHILL PLAZA,康怡廣場,康怡广场,22.284488,114.216658,
C26B0B206E75F5CC,BO FUNG GARDENS,寶峰園,宝峰园,22.284577,114.214805,
264D807284BEF1A8,QUARRY BAY STREET,鰂魚涌街,鲗鱼涌街,22.284692,114.212150,
0A9E349E178D498C,TAIKOO PLACE,太古坊,太古坊,22.286665,114.210464,
1E8FB68865850810,MANSION STREET,民新街,民新街,22.289744,114.209313,
73A2A03BA9A23247,MODEL HOUSING ESTATE,模範邨,模范邨,22.291510,114.207697,
3328A22FC67A46F9,HEALTHY VILLAGE,健康村,健康村,22.291872,114.206378,
745B539CC1A71251,ISLAND PLACE,港運城,港运城,22.291453,114.202388,
DDAA6CA9D68D3BA5,MARY COURT,美麗閣,美丽阁,22.290644,114.198396,
DA2677E4FF848D7C,FORTRESS HILL STATION,炮台山站,炮台山站,22.288858,114.194230,
65DFA1F84CD5A03B,TSING FUNG STREET,清風街,清风街,22.284932,114.193050,
6F873325365F265B,CAUSEWAY BAY (TIN HAU) BUS TERMINUS,銅鑼灣天后總站,铜锣湾天后总站,22.282649,114.191737,
E2FBAD0689E3EBC5,FU TIP BUS TERMINUS (TP931),富蝶總站 (TP931),富蝶总站 (TP931),22.462699,114.176025,
322A5914FD96DE4B,SHU KUK STREET,書局街,书局街,22.291222,114.200013,
A34AEEFEFB3013FC,NORTH POINT GOVERNMENT PRIMARY SCHOOL,北角官立小學,北角官立小学,22.289117,114.209810,
1A03767DB7C1824D,TAI HONG HOUSE,太康樓,太康楼,22.283115,114.221408,
4B792EF191200C0D,MA WAN(PAK YAN ROAD),馬灣(珀欣路),马湾(珀欣路),22.347285,114.059854,
D0EF3714A115BB3F,MA WAN RURAL COMMITTEE ROAD (SOUTH),馬灣鄉事會路(南),马湾乡事会路(南),22.351789,114.058767,
B52FC8FDDEDFC9B9,MA WAN RURAL COMMITTEE ROAD (NORTH),馬灣鄉事會路(北),马湾乡事会路(北),22.353218,114.059458,
1FFC3F4F451D2633,KEI WAI PRIMARY SCHOOL,基慧小學,基慧小学,22.350505,114.059531,
D0EF3BE4408865DE,MTR TSUEN WAN STATION,港鐵荃灣站,港铁荃湾站,22.372910,114.118874,
AE96DC654F4EB72E,TIN LIU NEW VILLAGE,田寮新村,田寮新村,22.352492,114.059743,
9774D8AAAD859409,MA WAN(PAK YAN ROAD),馬灣(珀欣路),马湾(珀欣路),22.347256,114.059732,
13CA5EE4FA7BFA4A,MTR TSUEN WAN STATION,港鐵荃灣站,港铁荃湾站,22.374113,114.117652,
A02CB1283981A937,MTR TSUEN WAN WEST STATION,港鐵荃灣西站,港铁荃湾西站,22.368443,114.112024,
2E86421BA0DF8AB9,MTR TSUEN WAN STATION,港鐵荃灣站,港铁荃湾站,22.373907,114.117613,
307AF4D72FFE9B6E,LUEN WO HUI BUS TERMINUS (ND962),聯和墟總站 (ND962),联和墟总站 (ND962),22.500346,114.143625,
B7F8CCEBD9365739,INTERNATIONAL ORGANIZATION FOR MEDIATION (WC721),國際調解院 (WC721),国际调解院 (WC721),22.279381,114.175326,
B500B9F38691F5AB,FENWICK STREET (WC722),分域街 (WC722),分域街 (WC722),22.279128,114.171209,
55371F963B58DC5B,ADMIRALTY CENTRE (C1) (CW750),海富中心 (C1) (CW750),海富中心 (C1) (CW750),22.279391,114.165461,
C0667F887514F03F,HSBC BUILDING (CW760),滙豐總行 (CW760),滙丰总行 (CW760),22.280636,114.159234,
DC5AC2E3C1153288,CENTRAL MARKET (CW764),中環街市 (CW764),中环街市 (CW764),22.284292,114.155832,
7397A6CBBD749279,SHEUNG WAN STATION (CW768),上環站 (CW768),上环站 (CW768),22.285953,114.153576,
B8CAE7A1372554AB,CENTRAL GOVERNMENT PIER (CW125),中區政府碼頭 (CW125),中区政府码头 (CW125),22.287398,114.154591,
255CE76A95FC1A80,CENTRAL FERRY PIER NO.5 (CW127),中環五號碼頭 (CW127),中环五号码头 (CW127),22.286980,114.159180,
24450906E5F3A75F,CENTRAL (HONG KONG STATION) BUS TERMINUS (CW920),中環(香港站)總站 (CW920),中环(香港站)总站 (CW920),22.286105,114.156748,
1E964671BE4EC7B5,RUMSEY STREET (CW140),林士街 (CW140),林士街 (CW140),22.286053,114.153811,
46CB01C7F12428A3,DOUGLAS STREET (CW144),德忌利士街 (CW144),德忌利士街 (CW144),22.283296,114.156887,
D5FEF340EE98A7E8,STATUE SQUARE (CW145),皇后像廣場 (CW145),皇后像广场 (CW145),22.280703,114.159910,
3FCC00D1D01ACD28,ADMIRALTY STATION (B1) (CW166),金鐘站 (B1) (CW166),金钟站 (B1) (CW166),22.278410,114.164530,
3E63535258CAA9BB,IMMIGRATION TOWER (WC201),入境事務大樓 (WC201),入境事务大楼 (WC201),22.279529,114.172673,
